Symbol,Name,Last Sale,Net Change,% Change,Market Cap,Country,IPO Year,Volume,Sector,Industry
IGI,Western Asset Investment Grade Defined Opportunity Trust Inc. Common Stock,$21.93,-0.08,-0.363%,237776464.00,United States,2009,13296,Finance,Investment Managers
IGR,CBRE Clarion Global Real Estate Income Fund Common Stock,$8.84,0.03,0.341%,1030659967.00,United States,2004,473436,Finance,Finance Companies
IGT,International Game Technology Ordinary Shares,$23.98,0.02,0.083%,4915585622.00,United States,2015,1697690,Consumer Services,Movies/Entertainment
IH,iHuman Inc. American depositary shares each representing five Class A ordinary shares,$10.70,0.36,3.482%,570571893.00,United States,2020,34976,Consumer Services,Other Consumer Services
IHC,Independence Holding Company Common Stock,$46.51,0.19,0.41%,680880773.00,United States,,14145,Finance,Life Insurance
IHD,Voya Emerging Markets High Income Dividend Equity Fund Common Shares,$8.28,-0.30,-3.497%,153406185.00,United States,2011,59890,Finance,Investment Managers
IHG,Intercontinental Hotels Group American Depositary Shares (Each representing one Ordinary Share),$67.36,0.67,1.005%,12341450776.00,United Kingdom,,52686,Consumer Services,Hotels/Resorts
IHIT,Invesco High Income 2023 Target Term Fund Common Shares of Beneficial Interest,$9.82,0.07,0.718%,236436032.00,United States,2016,95923,Finance,Investment Managers
IHTA,Invesco High Income 2024 Target Term Fund Common Shares of Beneficial Interest No par value per share,$9.79,-0.02,-0.204%,85973910.00,,2017,55428,Finance,Finance/Investors Services
IIAC,Investindustrial Acquisition Corp. Class A Ordinary Shares,$9.82,0.06,0.615%,494068750.00,United Kingdom,2021,18857,Finance,Business Services
IIF,Morgan Stanley India Investment Fund Inc. Common Stock,$24.60,-0.07,-0.284%,277345443.00,United States,1994,104823,Finance,Trusts Except Educational Religious and Charitable
IIIN,Insteel Industries Inc. Common Stock,$32.65,0.50,1.555%,631472027.00,United States,,39384,,
IIM,Invesco Value Municipal Income Trust Common Stock,$16.66,0.17,1.031%,783961590.00,United States,,131284,Finance,Investment Managers
IIPR,Innovative Industrial Properties Inc. Common Stock,$193.59,2.57,1.345%,4631895708.00,United States,2016,120758,Consumer Services,Real Estate
IIPR^A,Innovative Industrial Properties Inc. 9.00% Series A Cumulative Redeemable Preferred Stock,$36.35,0.00,0.00%,,United States,,1331,,
IMAX,Imax Corporation Common Stock,$21.80,0.30,1.395%,1294019202.00,Canada,,506234,,
IMPX,AEA-Bridges Impact Corp. Class A Ordinary Shares,$9.75,0.01,0.103%,487500000.00,,2020,24322,Finance,Business Services
INFO,IHS Markit Ltd. Common Shares,$113.23,0.57,0.506%,45134869823.00,Bermuda,1996,1613606,Technology,EDP Services
INFY,Infosys Limited American Depositary Shares,$20.96,-0.23,-1.085%,88991067370.00,India,,4670643,Technology,EDP Services
ING,ING Group N.V. Common Stock,$13.44,0.20,1.511%,52460735699.00,Netherlands,1997,2527479,Finance,Commercial Banks
INGR,Ingredion Incorporated Common Stock,$90.99,0.49,0.541%,6094096014.00,United States,,456302,Consumer Non-Durables,Farming/Seeds/Milling
INN,Summit Hotel Properties Inc. Common Stock,$9.46,0.13,1.393%,1003906684.00,United States,2011,469457,Consumer Services,Real Estate Investment Trusts
INN^D,Summit Hotel Properties Inc. 6.45% Series D Cumulative Redeemable Preferred Stock,$25.2217,0.0417,0.166%,,United States,,202,,
INN^E,Summit Hotel Properties Inc. 6.250% Series E Cumulative Redeemable Preferred Stock,$26.115,0.005,0.019%,,United States,,1998,,
INS,Intelligent Systems Corporation Common Stock,$31.69,0.23,0.731%,281481672.00,United States,1992,95163,Technology,Retail: Computer Software & Peripheral Equipment
INSI,Insight Select Income Fund,$21.43,-0.23,-1.062%,229516050.00,United States,,7115,Finance,Investment Managers
INSP,Inspire Medical Systems Inc. Common Stock,$198.33,5.07,2.623%,5397259008.00,United States,1998,221193,Health Care,Biotechnology: Electromedical & Electrotherapeutic Apparatus
INSW,International Seaways Inc. Common Stock ,$18.73,-0.45,-2.346%,526069716.00,,2016,188434,Technology,Semiconductors
INSW^A,International Seaways Inc. 8.50% Senior Notes due June 30 2023,$25.79,0.19,0.742%,,,,200,,
INT,World Fuel Services Corporation Common Stock,$32.25,0.52,1.639%,2039329718.00,United States,,513876,Energy,Oil Refining/Marketing
INVH,Invitation Homes Inc. Common Stock,$37.54,0.25,0.67%,21309597292.00,United States,2017,7768517,Consumer Services,Real Estate Investment Trusts
IO,Ion Geophysical Corporation Common Stock,$2.10,0.01,0.478%,60503535.00,United States,,513921,Energy,Oilfield Services/Equipment
IP,International Paper Company Common Stock,$61.48,0.17,0.277%,24084131180.00,United States,,2054750,Basic Industries,Paper
IPG,Interpublic Group of Companies Inc. (The) Common Stock,$33.15,0.66,2.031%,13040402731.00,United States,,2951502,Technology,Advertising
IPI,Intrepid Potash Inc Common Stock,$32.44,0.58,1.82%,436181849.00,United States,2008,97272,Basic Industries,Major Chemicals
IPOD,Social Capital Hedosophia Holdings Corp. IV Class A Ordinary Shares,$10.41,0.02,0.192%,598575000.00,United States,2020,180914,Finance,Business Services
IPOF,Social Capital Hedosophia Holdings Corp. VI Class A Ordinary Shares,$10.22,0.02,0.196%,1469125000.00,United States,2020,729468,Finance,Business Services
IPVA,InterPrivate II Acquisition Corp. Class A Common Stock,$9.70,0.00,0.00%,313734375.00,,2021,23870,,
IPVF,InterPrivate III Financial Partners Inc. Class A Common Stock,$9.70,0.00,0.00%,313734375.00,,2021,459,,
IQI,Invesco Quality Municipal Income Trust Common Stock,$13.53,0.03,0.222%,715517773.00,United States,,57614,Finance,Finance Companies
IQV,IQVIA Holdings Inc. Common Stock,$247.14,4.82,1.989%,47367142542.00,United States,2013,910413,Health Care,Managed Health Care
IR,Ingersoll Rand Inc. Common Stock,$48.61,-0.20,-0.41%,20389600657.00,United States,2017,2471873,Capital Goods,Industrial Machinery/Components
IRL,New Ireland Fund Inc (The) Common Stock,$12.33,0.14,1.148%,59839981.00,United States,1990,5218,Finance,Trusts Except Educational Religious and Charitable
IRM,Iron Mountain Incorporated (Delaware)Common Stock REIT,$42.62,0.30,0.709%,12305719098.00,United States,,2020507,Consumer Services,Real Estate Investment Trusts
IRS,IRSA Inversiones Y Representaciones S.A. Common Stock,$3.81,0.10,2.695%,220498660.00,Argentina,,29173,Consumer Services,Homebuilding
IRT,Independence Realty Trust Inc. Common Stock,$18.16,-0.07,-0.384%,1854998818.00,United States,2013,449475,Consumer Services,Real Estate Investment Trusts
IS,ironSource Ltd. Class A Ordinary Shares,$10.76,0.26,2.476%,0.00,,2021,1408754,,
ISD,PGIM High Yield Bond Fund Inc.,$16.29,0.02,0.123%,541752050.00,United States,2012,138611,Finance,Trusts Except Educational Religious and Charitable
ISOS,Isos Acquisition Corporation Class A Ordinary Shares,$9.92,0.0401,0.406%,315998872.00,,2021,5245616,,
IT,Gartner Inc. Common Stock,$248.43,6.23,2.572%,21383992099.00,United States,1993,684929,Finance,Diversified Commercial Services
ITCB,Itau CorpBanca American Depositary Shares (each representing 1500 shares of Common Stock no par value),$4.32,0.09,2.128%,1475731466.00,Chile,,86542,Finance,Commercial Banks
ITGR,Integer Holdings Corporation Common Stock,$95.12,0.92,0.977%,3136590085.00,United States,,136739,Health Care,Medical/Dental Instruments
ITT,ITT Inc. Common Stock ,$93.76,2.17,2.369%,8072736000.00,United States,2011,611466,Capital Goods,Fluid Controls
ITUB,Itau Unibanco Banco Holding SA American Depositary Shares (Each repstg 500 Preferred shares),$5.85,-0.16,-2.662%,57354191786.00,Brazil,,30496397,Finance,Commercial Banks
ITW,Illinois Tool Works Inc. Common Stock,$224.61,1.05,0.47%,70950420435.00,United States,,779211,Capital Goods,Industrial Machinery/Components
IVAN,Ivanhoe Capital Acquisition Corp. Class A Ordinary Shares,$10.18,0.01,0.098%,351210000.00,,2021,107605,Finance,Business Services
IVC,Invacare Corporation Common Stock,$8.17,0.10,1.239%,285583886.00,United States,,429411,Health Care,Industrial Specialties
IVH,Delaware Ivy High Income Opportunities Fund,$13.93,-0.12,-0.854%,230820100.00,,2013,28136,Finance,Investment Managers
IVR,INVESCO MORTGAGE CAPITAL INC Common Stock,$3.86,-0.04,-1.026%,1095845161.00,United States,2009,7289109,Consumer Services,Real Estate Investment Trusts
IVR^B,Invesco Mortgage Capital Inc. Preferred Series B Cum Fxd to Fltg,$25.00,-0.05,-0.20%,,United States,,25850,,
IVR^C,INVESCO MORTGAGE CAPITAL INC 7.5% Fixed-to-Floating Series C Cumulative Redeemable Preferred Stock Liquation Preference $25.00 per Share,$24.97,-0.10,-0.399%,,United States,,15222,,
IVZ,Invesco Ltd Common Stock,$26.95,0.22,0.823%,12436106849.00,United States,,3398623,Finance,Investment Managers
IX,Orix Corp Ads Common Stock,$84.62,-0.04,-0.047%,19445875788.00,Japan,,20290,Finance,Diversified Financial Services
J,Jacobs Engineering Group Inc. Common Stock,$134.31,0.89,0.667%,17489229434.00,United States,,385231,Capital Goods,Oilfield Services/Equipment
JAX,J. Alexander's Holdings Inc. Common Stock,$12.26,0.62,5.326%,185004344.00,,2015,35670,Consumer Services,Restaurants
JBGS,JBG SMITH Properties Common Shares ,$31.65,0.14,0.444%,4161948066.00,United States,2017,636027,Consumer Services,Real Estate Investment Trusts
JBI,Janus International Group Inc. Common Stock,$13.78,-0.35,-2.477%,594262500.00,,2021,376759,,
JBK,Lehman ABS 3.50 3.50% Adjustable Corp Backed Tr Certs GS Cap I,$30.786,0.7123,2.369%,0.00,United States,,1205,Finance,Trusts Except Educational Religious and Charitable
JBL,Jabil Inc. Common Stock,$58.06,-0.06,-0.103%,8639209732.00,United States,1993,647728,Technology,Electrical Products
JBT,John Bean Technologies Corporation Common Stock,$142.64,0.02,0.014%,4528867784.00,United States,,197119,Capital Goods,Diversified Manufacture
JCE,Nuveen Core Equity Alpha Fund Nuveen Core Equity Alpha Fund Common Shares of Beneficial Interest,$16.57,0.13,0.791%,265605186.00,United States,2007,78123,Finance,Trusts Except Educational Religious and Charitable
JCI,Johnson Controls International plc Ordinary Share,$69.01,0.38,0.554%,49460508430.00,Switzerland,,2842010,Capital Goods,Auto Parts:O.E.M.
JCO,Nuveen Credit Opportunities 2022 Target Term Fund Common Shares of Beneficial Interest,$8.33,0.02,0.241%,231161598.00,United States,2017,36813,Finance,Trusts Except Educational Religious and Charitable
JDD,Nuveen Diversified Dividend and Income Fund Shares of Beneficial Interest,$10.42,0.02,0.192%,204945947.00,United States,2003,103307,Finance,Finance Companies
JEF,Jefferies Financial Group Inc. Common Stock,$33.84,-0.36,-1.053%,8357545779.00,United States,,1956274,Finance,Investment Bankers/Brokers/Service
JELD,JELD-WEN Holding Inc. Common Stock,$26.71,0.45,1.714%,2648680563.00,United States,2017,264931,,
JEMD,Nuveen Emerging Markets Debt 2022 Target Term Fund Common Shares of Beneficial Interest $0.01 par value per share,$8.12,0.00,0.00%,115685575.00,,2017,33974,Finance,Investment Managers
JEQ,Aberdeen Japan Equity Fund Inc.  Common Stock,$8.79,-0.02,-0.227%,117861023.00,United States,1992,40953,Finance,Finance Companies
JFR,Nuveen Floating Rate Income Fund Common Stock,$10.00,-0.02,-0.20%,569184680.00,United States,2004,335852,Finance,Trusts Except Educational Religious and Charitable
JGH,Nuveen Global High Income Fund Common Shares of Beneficial Interest,$16.26,0.05,0.308%,376864410.00,United States,2014,75298,Finance,Investment Managers
JHAA,Nuveen Corporate Income 2023 Target Term Fund,$9.9128,-0.0472,-0.474%,77572210.00,,2018,8599,Finance,Finance/Investors Services
JHB,Nuveen Corporate Income November 2021 Target Term Fund,$9.39,-0.03,-0.318%,524901460.00,,2016,129285,Finance,Investment Managers
JHG,Janus Henderson Group plc Ordinary Shares,$38.94,0.13,0.335%,6711308572.00,,2017,1044106,Finance,Investment Managers
JHI,John Hancock Investors Trust Common Stock,$18.84,0.00,0.00%,164040351.00,United States,,22155,Finance,Trusts Except Educational Religious and Charitable
JHS,John Hancock Income Securities Trust Common Stock,$16.09,0.099,0.619%,187393537.00,United States,,17273,Finance,Finance Companies
JHX,James Hardie Industries plc American Depositary Shares (Ireland),$33.59,-0.60,-1.755%,14923663278.00,Ireland,,36569,Capital Goods,Building Materials
JILL,J. Jill Inc. Common Stock,$20.73,1.02,5.175%,206964982.00,,2017,200202,Consumer Non-Durables,Apparel
JKS,JinkoSolar Holding Company Limited American Depositary Shares (each representing 4 Common Shares),$52.07,-3.95,-7.051%,2482641781.00,China,2010,2378030,Technology,Semiconductors
JLL,Jones Lang LaSalle Incorporated Common Stock,$199.12,3.66,1.873%,10216283690.00,United States,,493717,Finance,Real Estate
JLS,Nuveen Mortgage and Income Fund,$21.07,0.18,0.862%,115620361.00,United States,2009,17748,Finance,Investment Managers
JMIA,Jumia Technologies AG American Depositary Shares each representing two Ordinary Shares,$28.65,-1.68,-5.539%,2824677532.00,,2019,4167013,Consumer Services,Catalog/Specialty Distribution
JMM,Nuveen Multi-Market Income Fund (MA),$7.44,-0.0238,-0.319%,70399891.00,United States,,5397,Finance,Trusts Except Educational Religious and Charitable
JMP,JMP Group LLC Common Shares,$6.27,0.14,2.284%,124475131.00,United States,2007,89190,Finance,Investment Bankers/Brokers/Service
JNJ,Johnson & Johnson Common Stock,$165.96,1.22,0.741%,437038400658.00,United States,,6317923,Health Care,Major Pharmaceuticals
JNPR,Juniper Networks Inc. Common Stock,$27.30,-0.05,-0.183%,8947305276.00,United States,1999,2663262,Technology,Computer peripheral equipment
JOE,St. Joe Company (The) Common Stock,$45.26,0.65,1.457%,2665024168.00,United States,,99711,Consumer Services,Homebuilding
JOF,Japan Smaller Capitalization Fund Inc Common Stock,$8.98,-0.04,-0.443%,254438359.00,United States,1990,17860,Finance,Trusts Except Educational Religious and Charitable
JP,Jupai Holdings Limited American Depositary Shares each representing six ordinary shares,$1.71,-0.03,-1.724%,56815048.00,,2015,140223,Consumer Services,Other Consumer Services
JPC,Nuveen Preferred & Income Opportunities Fund,$10.01,0.03,0.301%,1034585041.00,United States,2003,192777,Finance,Investment Managers
JPI,Nuveen Preferred and Income Term Fund Common Shares of Beneficial Interest,$25.43,-0.07,-0.275%,578822173.00,,2012,27583,Finance,Finance Companies
JPM,JP Morgan Chase & Co. Common Stock,$157.08,1.54,0.99%,475501283833.00,United States,,10475693,Finance,Major Banks
JPM^C,J P Morgan Chase & Co Depositary Shares each representing a 1/400th interest in a share of 6.00% Non-Cumulative  Preferred Stock Series EE,$28.78,-0.05,-0.173%,,United States,,107568,,
JPM^D,J P Morgan Chase & Co Depositary Shares each representing a 1/400th  interest in a share of 5.75% Non-Cumulative  Preferred Stock Series DD,$28.17,-0.08,-0.283%,,United States,,88937,,
JPM^J,J P Morgan Chase & Co Depositary Shares each representing a 1/400th interest in a share of JPMorgan Chase & Co. 4.75% Non-Cumulative Preferred Stock Series GG,$27.27,-0.04,-0.146%,,United States,,48218,,
JPM^K,J P Morgan Chase & Co Depositary Shares each representing a 1/400th interest in a share of 4.55% Non-Cumulative Preferred Stock Series JJ,$26.66,0.04,0.15%,,United States,,275486,,
JPM^L,J P Morgan Chase & Co Depositary Shares each representing a 1/400th interest in a share of 4.625% Non-Cumulative Preferred Stock Series LL,$26.68,0.05,0.188%,,United States,,178027,,
JPS,Nuveen Preferred & Income Securities Fund,$10.00,0.04,0.402%,2037901470.00,United States,2002,336351,Finance,Investment Managers
JPT,Nuveen Preferred and Income 2022 Term Fund Common Shares of Beneficial Interest,$25.07,0.08,0.32%,171505675.00,United States,2017,15919,Finance,Trusts Except Educational Religious and Charitable
JQC,Nuveen Credit Strategies Income Fund Shares of Beneficial Interest,$6.76,0.01,0.148%,916718800.00,United States,2003,821863,Finance,Finance Companies
JRI,Nuveen Real Asset Income and Growth Fund Common Shares of Beneficial Interest,$16.11,0.04,0.249%,442278785.00,United States,2012,61425,Finance,Finance Companies
JRO,Nuveen Floating Rate Income Opportuntiy Fund Shares of Beneficial Interest,$9.79,0.03,0.307%,396898524.00,United States,2004,225648,Finance,Investment Managers
JRS,Nuveen Real Estate Income Fund Common Shares of Beneficial Interest,$11.17,0.08,0.721%,322728901.00,United States,2001,166740,Finance,Finance/Investors Services
JSD,Nuveen Short Duration Credit Opportunities Fund Common Shares of Beneficial Interest,$15.02,0.03,0.20%,151486433.00,United States,2011,27836,Finance,Finance Companies
JT,Jianpu Technology Inc. American depositary shares,$2.72,0.06,2.256%,57613337.00,,2017,83073,Technology,EDP Services
JTA,Nuveen Tax-Advantaged Total Return Strategy Fund Common Share of Beneficial Interest,$11.74,0.06,0.514%,162609531.00,United States,2004,62228,Finance,Finance Companies
JTD,Nuveen Tax-Advantaged Dividend Growth Fund Common Shares of Beneficial Interest,$16.07,0.00,0.00%,232763344.00,United States,,63431,Finance,Trusts Except Educational Religious and Charitable
JW/A,John Wiley & Sons Inc.,$60.00,-0.18,-0.299%,,United States,,348653,,
JW/B,John Wiley & Sons Inc.,$59.91,0.00,0.00%,,United States,,87,,
JWN,Nordstrom Inc. Common Stock,$36.50,-0.07,-0.191%,5799801674.00,United States,,2686332,Consumer Services,Clothing/Shoe/Accessory Stores
JWSM,Jaws Mustang Acquisition Corp. Class A Ordinary Shares,$9.78,0.02,0.205%,1265287500.00,,2021,133618,Finance,Business Services
K,Kellogg Company Common Stock,$63.97,-0.36,-0.56%,21781550614.00,United States,,2290536,Consumer Non-Durables,Packaged Foods
KAHC,KKR Acquisition Holdings I Corp. Class A Common Stock,$9.73,-0.09,-0.916%,1678425000.00,,2021,261531,,
KAI,Kadant Inc Common Stock,$178.52,2.43,1.38%,2066865286.00,United States,,20045,Technology,Industrial Machinery/Components
KAMN,Kaman Corporation Common Stock,$51.09,0.69,1.369%,1420815761.00,United States,,218660,Capital Goods,Military/Government/Technical
KAR,KAR Auction Services Inc Common Stock,$17.83,0.28,1.595%,2224490413.00,United States,2009,4342691,,
KB,KB Financial Group Inc,$48.90,-0.40,-0.811%,19053118982.00,South Korea,,291307,Finance,Commercial Banks
KBH,KB Home Common Stock,$41.84,1.12,2.75%,4133095029.00,United States,1986,1800787,,
KBR,KBR Inc. Common Stock,$38.53,0.38,0.996%,5446069047.00,United States,2006,1286846,Capital Goods,Oilfield Services/Equipment
KCAC,Kensington Capital Acquisition Corp. II Class A Common Stock,$9.95,0.00,0.00%,286062500.00,,2021,125163,Finance,Business Services
KEN,Kenon Holdings Ltd. Ordinary Shares,$33.92,-0.63,-1.823%,1827579649.00,Singapore,2015,15895,Public Utilities,Electric Utilities: Central
KEP,Korea Electric Power Corporation Common Stock,$10.77,-0.03,-0.278%,13827906219.00,South Korea,1994,201771,Consumer Durables,Electrical Products
KEX,Kirby Corporation Common Stock,$61.57,0.93,1.534%,3700664850.00,United States,,522100,Transportation,Marine Transportation
KEY,KeyCorp Common Stock,$20.89,0.24,1.162%,20274151060.00,United States,,6113744,Finance,Major Banks
KEY^I,KeyCorp Depositary Shares Each Representing a 1/40th Ownership Interest in a Share of Fixed-to-Floating Rate Perpetual Non-Cumulative Preferred Stock Series E,$30.49,-0.09,-0.294%,,United States,,35030,,
KEY^J,KeyCorp Depositary Shares each representing a 1/40th ownership interest in a share of Fixed Rate Perpetual Non-Cumulative Preferred Stock Series F,$27.549,-0.171,-0.617%,,United States,,15501,,
KEY^K,KeyCorp Depositary Shares each representing a 1/40th ownership interest in a share of Fixed Rate Perpetual Non-Cumulative Preferred Stock Series G,$28.4521,-0.0279,-0.098%,,United States,,14762,,
KEYS,Keysight Technologies Inc. Common Stock,$153.56,-0.85,-0.55%,28289742410.00,United States,2014,1137254,Capital Goods,Industrial Machinery/Components
KF,Korea Fund Inc. (The) New Common Stock,$46.07,-0.0901,-0.195%,231270294.00,United States,,3563,Finance,Investment Managers
KFS,Kingsway Financial Services Inc. Common Stock (DE),$5.15,0.15,3.00%,122084000.00,Canada,,21693,,
KFY,Korn Ferry Common Stock,$73.31,0.76,1.048%,3959326480.00,United States,1999,159003,Technology,Diversified Commercial Services
KGC,Kinross Gold Corporation Common Stock,$6.36,0.01,0.157%,8021232000.00,Canada,,6354583,Basic Industries,Precious Metals
KIM,Kimco Realty Corporation Common Stock,$21.08,0.23,1.103%,9138512558.00,United States,,4023495,Consumer Services,Real Estate Investment Trusts
KIM^L,Kimco Realty Corporation Class L Depositary Shares each of which represents a one-one thousandth fractional interest in a share of 5.125% Class L Cumulative Redeemable Preferred Stock liquidation preference $25000.00 per share,$26.10,0.17,0.656%,,United States,,8519,,
KIM^M,Kimco Realty Corporation Class M Depositary Shares each of which represents a one-one thousandth fractional interest in a share of 5.25% Class M Cumulative Redeemable Preferred Stock liquidation preference $25000.00 per share,$26.64,-0.11,-0.411%,,United States,,20779,,
KIO,KKR Income Opportunities Fund Common Shares,$16.71,0.03,0.18%,339886664.00,,2013,40410,Finance,Investment Managers
KKR,KKR & Co. Inc. Common Stock,$59.75,0.51,0.861%,34761280014.00,United States,,2014204,Finance,Investment Managers
KKR^B,KKR & Co. Inc. 6.50% Series B Preferred Stock,$25.37,0.05,0.197%,,United States,,20279,,
KKR^C,KKR & Co. Inc. 6.00% Series C Mandatory Convertible Preferred Stock,$77.49,0.43,0.558%,,United States,,73466,,
KKRS,KKR Group Finance Co. IX LLC 4.625% Subordinated Notes due 2061,$25.93,0.12,0.465%,0.00,,2021,39705,,
KL,Kirkland Lake Gold Ltd. Common Shares,$38.38,-0.15,-0.389%,10250640704.00,,,943014,Basic Industries,Precious Metals
KMB,Kimberly-Clark Corporation Common Stock,$133.52,-0.26,-0.194%,45053865630.00,United States,,1594631,Basic Industries,Paper
KMF,Kayne Anderson NextGen Energy & Infrastructure Inc.,$7.68,0.11,1.453%,362476508.00,,2010,190021,Finance,Investment Managers
KMI,Kinder Morgan Inc. Common Stock,$18.43,0.20,1.097%,41736257005.00,United States,2011,8062321,Public Utilities,Natural Gas Distribution
KMPR,Kemper Corporation,$74.68,0.78,1.055%,4821826668.00,United States,,216098,Finance,Property-Casualty Insurers
KMT,Kennametal Inc. Common Stock,$36.30,0.38,1.058%,3034630959.00,United States,,458620,Capital Goods,Industrial Machinery/Components
KMX,CarMax Inc,$130.58,1.43,1.107%,21276059743.00,United States,,1055266,Consumer Services,Other Specialty Stores
KN,Knowles Corporation Common Stock,$19.74,0.00,0.00%,1831742703.00,,2014,426055,Consumer Non-Durables,Consumer Electronics/Appliances
KNL,Knoll Inc. Common Stock,$26.48,0.49,1.885%,1346275188.00,United States,2004,467700,Consumer Durables,Office Equipment/Supplies/Services
KNOP,KNOT Offshore Partners LP Common Units representing Limited Partner Interests,$19.97,-0.01,-0.05%,652901057.00,United Kingdom,2013,95881,Transportation,Marine Transportation
KNX,Knight-Swift Transportation Holdings Inc.,$45.82,0.36,0.792%,7583698350.00,United States,2017,1614153,Transportation,Trucking Freight/Courier Services
KO,Coca-Cola Company (The) Common Stock,$53.96,-0.15,-0.277%,232628516739.00,United States,,13212495,Consumer Non-Durables,Beverages (Production/Distribution)
KODK,Eastman Kodak Company Common New,$8.32,0.00,0.00%,653148920.00,United States,,1991822,Miscellaneous,Business Services
KOF,Coca Cola Femsa S.A.B. de C.V.  American Depositary Shares each representing 10 Units (each Unit consists of 3 Series B Shares and 5 Series L Shares),$52.95,0.02,0.038%,11123906817.00,Mexico,1993,130787,Consumer Non-Durables,Beverages (Production/Distribution)
KOP,Koppers Holdings Inc. Koppers Holdings Inc. Common Stock,$32.48,0.13,0.402%,689903165.00,United States,2006,157603,Basic Industries,Industrial Specialties
KOS,Kosmos Energy Ltd. Common Shares (DE),$3.61,0.15,4.335%,1473054417.00,Bermuda,2011,9084975,Energy,Oil & Gas Production
KR,Kroger Company (The) Common Stock,$38.13,-0.18,-0.47%,28492187952.00,United States,,5588833,Consumer Services,Food Chains
KRA,Kraton Corporation Common Stock,$32.50,0.21,0.65%,1044681528.00,United States,2009,161771,Basic Industries,Major Chemicals
KRC,Kilroy Realty Corporation Common Stock,$69.78,0.14,0.201%,8125906819.00,United States,1997,1308085,Consumer Services,Real Estate Investment Trusts
KREF,KKR Real Estate Finance Trust Inc. Common Stock,$21.93,0.30,1.387%,1220129936.00,United States,2017,299946,Consumer Services,Real Estate Investment Trusts
KREF^A,KKR Real Estate Finance Trust Inc. 6.50% Series A Cumulative Redeemable Preferred Stock,$27.20,-0.14,-0.512%,,United States,,144585,,
KRG,Kite Realty Group Trust Common Stock,$22.09,0.08,0.363%,1866284253.00,United States,2004,516847,Consumer Services,Real Estate Investment Trusts
KRO,Kronos Worldwide Inc Common Stock,$14.27,-0.05,-0.349%,1648794572.00,United States,,131702,Basic Industries,Major Chemicals
KRP,Kimbell Royalty Partners Common Units Representing Limited Partner Interests,$13.09,0.24,1.868%,786475448.00,United States,2017,291799,Energy,Oil & Gas Production
KSM,DWS Strategic Municipal Income Trust,$12.5993,0.0093,0.074%,141161814.00,United States,1989,16344,Finance,Trusts Except Educational Religious and Charitable
KSS,Kohl's Corporation Common Stock,$55.16,0.05,0.091%,8617814983.00,United States,1992,2043132,Consumer Services,Department/Specialty Retail Stores
KSU,Kansas City Southern Common Stock,$284.82,1.45,0.512%,25899848083.00,United States,,330110,Transportation,Railroads
KSU^,Kansas City Southern Preferred Stock,$37.50,-0.10,-0.266%,,United States,,193,,
KT,KT Corporation Common Stock,$14.00,0.05,0.358%,6558754832.00,South Korea,,308838,Public Utilities,Telecommunications Equipment
KTB,Kontoor Brands Inc. Common Stock ,$57.84,1.43,2.535%,3333405671.00,,2019,609845,,
KTF,DWS Municipal Income Trust,$12.26,0.03,0.245%,484281500.00,United States,1988,40781,Finance,Finance Companies
