Symbol,Name,Last Sale,Net Change,% Change,Market Cap,Country,IPO Year,Volume,Sector,Industry
PFO,Flaherty & Crumrine Preferred and Income Opportunity Fund Incorporated,$13.365,0.015,0.112%,170373452.00,United States,1992,13557,Finance,Finance Companies
PFS,Provident Financial Services Inc Common Stock,$23.14,0.25,1.092%,1804151636.00,United States,2003,254343,Finance,Savings Institutions
PFSI,PennyMac Financial Services Inc. Common Stock,$60.27,-1.45,-2.349%,4022070113.00,United States,2013,1267361,Finance,Finance: Consumer Services
PG,Procter & Gamble Company (The) Common Stock,$135.24,0.31,0.23%,331099001979.00,United States,,5922298,Consumer Non-Durables,Package Goods/Cosmetics
PGP,Pimco Global Stocksplus & Income Fund Pimco Global StocksPlus & Income Fund Common Shares of Beneficial Interest,$11.22,0.12,1.081%,124251862.00,United States,2005,42115,Finance,Finance Companies
PGR,Progressive Corporation (The) Common Stock,$98.84,0.63,0.641%,57851052000.00,United States,,2436736,Finance,Property-Casualty Insurers
PGRE,Paramount Group Inc. Common Stock,$10.21,0.14,1.39%,2235485585.00,United States,2014,2507422,Consumer Services,Real Estate Investment Trusts
PGTI,PGT Innovations Inc.,$23.26,0.03,0.129%,1385012211.00,United States,2006,323167,Capital Goods,Building Products
PGZ,Principal Real Estate Income Fund Common Shares of Beneficial Interest,$15.22,0.05,0.33%,104505421.00,,2013,30616,Finance,Investment Managers
PH,Parker-Hannifin Corporation Common Stock,$307.03,-0.08,-0.026%,39624046793.00,United States,,996488,Capital Goods,Office Equipment/Supplies/Services
PHD,Pioneer Floating Rate Fund Inc.,$11.98,0.05,0.419%,296363325.00,United States,2004,23507,Finance,Investment Managers
PHG,Koninklijke Philips N.V. NY Registry Shares,$49.04,-0.66,-1.328%,44698697759.00,Netherlands,,965875,Health Care,Biotechnology: Electromedical & Electrotherapeutic Apparatus
PHI,PLDT Inc. Sponsored ADR,$26.58,0.30,1.142%,5742762500.00,Philippines,,61583,Public Utilities,Telecommunications Equipment
PHK,Pimco High Income Fund Pimco High Income Fund,$6.87,0.03,0.439%,917824697.00,United States,2003,281853,Finance,Finance/Investors Services
PHM,PulteGroup Inc. Common Stock,$55.82,1.25,2.291%,14678768874.00,United States,,3119024,,
PHR,Phreesia Inc. Common Stock,$62.00,0.70,1.142%,3132216564.00,United States,2019,282378,Health Care,Managed Health Care
PHT,Pioneer High Income Fund Inc.,$9.84,0.13,1.339%,287640627.00,United States,,64234,Finance,Investment Managers
PHX,PHX Minerals Inc. Common Stock,$3.78,0.06,1.613%,114916415.00,United States,,233048,Energy,Oil & Gas Production
PIAI,Prime Impact Acquisition I Class A Ordinary Shares,$9.79,0.04,0.41%,331937929.00,,2020,22419,Finance,Business Services
PICC,Pivotal Investment Corporation III Class A Common Stock,$9.75,0.00,0.00%,336375000.00,,2021,59376,,
PII,Polaris Inc. Common Stock,$134.33,-2.63,-1.92%,8226648069.00,United States,,967724,Consumer Non-Durables,Recreational Products/Toys
PIM,Putnam Master Intermediate Income Trust Common Stock,$4.20,0.01,0.239%,214929565.00,United States,1988,103294,Finance,Finance Companies
PINE,Alpine Income Property Trust Inc. Common Stock,$19.31,0.29,1.525%,209838024.00,United States,2019,84028,Consumer Services,Real Estate Investment Trusts
PING,Ping Identity Holding Corp. Common Stock,$23.28,0.38,1.659%,1910977561.00,United States,2019,1141394,Technology,EDP Services
PINS,Pinterest Inc. Class A Common Stock,$79.86,0.91,1.153%,50859716745.00,,2019,7486328,,
PIPP,Pine Island Acquisition Corp. Class A Common Stock,$9.75,0.02,0.206%,266160375.00,United States,2021,57842,,
PIPR,Piper Sandler Companies Common Stock,$130.27,0.71,0.548%,1872553739.00,United States,,38378,Finance,Investment Bankers/Brokers/Service
PJT,PJT Partners Inc. Class A Common Stock,$71.43,0.05,0.07%,2944372029.00,United States,2015,239144,Finance,Investment Managers
PK,Park Hotels & Resorts Inc. Common Stock ,$20.78,0.17,0.825%,4914272839.00,United States,2016,2726807,Consumer Services,Real Estate Investment Trusts
PKE,Park Aerospace Corp. Common Stock,$15.06,0.16,1.074%,306966113.00,United States,,52137,Technology,Electrical Products
PKG,Packaging Corporation of America Common Stock,$136.54,1.12,0.827%,12970489772.00,United States,2000,414418,Basic Industries,Paper
PKI,PerkinElmer Inc. Common Stock,$154.60,0.19,0.123%,17329295655.00,United States,,690532,Health Care,Medical Specialities
PKO,Pimco Income Opportunity Fund Common Shares of Beneficial Interest,$26.77,0.12,0.45%,556001228.00,United States,,65353,Finance,Finance/Investors Services
PKX,POSCO Common Stock,$76.46,-0.31,-0.404%,23129324940.00,South Korea,1994,85780,Basic Industries,Steel/Iron Ore
PLAN,Anaplan Inc. Common Stock,$53.14,-0.16,-0.30%,7691058958.00,United States,2018,1730019,Technology,Computer Software: Prepackaged Software
PLD,Prologis Inc. Common Stock,$119.98,0.45,0.376%,88757964540.00,United States,,3211535,Consumer Services,Real Estate Investment Trusts
PLNT,Planet Fitness Inc. Common Stock,$75.42,0.17,0.226%,6530278636.00,United States,2015,693215,Consumer Services,Other Consumer Services
PLOW,Douglas Dynamics Inc. Common Stock,$40.99,0.30,0.737%,940944797.00,United States,2010,93634,Capital Goods,Construction/Ag Equipment/Trucks
PLTR,Palantir Technologies Inc. Class A Common Stock,$24.72,-1.64,-6.222%,46393168660.00,,2020,55430172,Technology,Computer Software: Prepackaged Software
PLYM,Plymouth Industrial REIT Inc. Common Stock,$20.13,0.11,0.549%,591919006.00,United States,2017,218675,Consumer Services,Real Estate Investment Trusts
PM,Philip Morris International Inc Common Stock,$99.89,0.78,0.787%,155682260630.00,United States,,3613610,Consumer Non-Durables,Farming/Seeds/Milling
PMF,PIMCO Municipal Income Fund Common Stock,$15.09,0.17,1.139%,391449690.00,United States,2001,25901,Finance,Finance/Investors Services
PML,Pimco Municipal Income Fund II Common Shares of Beneficial Interest,$15.07,-0.01,-0.066%,949093530.00,United States,2002,70337,Finance,Investment Managers
PMM,Putnam Managed Municipal Income Trust Common Stock,$8.86,0.09,1.026%,433076809.00,United States,1989,52190,Finance,Investment Managers
PMO,Putnam Municipal Opportunities Trust Common Stock,$14.25,0.11,0.778%,486063026.00,United States,1993,72219,Finance,Finance Companies
PMT,PennyMac Mortgage Investment Trust Common Shares of Beneficial Interest,$21.07,0.01,0.047%,2062990016.00,United States,2009,539175,Consumer Services,Real Estate Investment Trusts
PMT^A,PennyMac Mortgage Investment Trust 8.125% Series A Fixed-to-Floating Rate Cumulative Redeemable Preferred Shares of Beneficial Interest,$26.59,0.10,0.378%,,United States,,4552,,
PMT^B,PennyMac Mortgage Investment Trust 8.00% Series B Fixed-to-Floating Rate Cumulative Redeemable Preferred Shares of Beneficial Interest,$27.43,0.16,0.587%,,United States,,16815,,
PMVC,PMV Consumer Acquisition Corp. Class A Common Stock,$9.73,-0.02,-0.205%,212843750.00,United States,2020,17322,,
PMX,PIMCO Municipal Income Fund III Common Shares of Beneficial Interest,$13.20,0.13,0.995%,437646000.00,United States,2002,35142,Finance,Trusts Except Educational Religious and Charitable
PNC,PNC Financial Services Group Inc. (The) Common Stock,$191.74,0.98,0.514%,81462339837.00,United States,,1045441,Finance,Major Banks
PNC^P,PNC Financial Services Group Inc. (The) Depositary Shares Representing 1/4000th Perpetual Preferred Series P,$26.36,0.01,0.038%,,United States,,224493,,
PNF,PIMCO New York Municipal Income Fund Common Stock,$12.82,-0.15,-1.157%,100367780.00,United States,2001,3836,Finance,Finance Companies
PNI,Pimco New York Municipal Income Fund II Common Shares of Beneficial Interest,$11.975,-0.075,-0.622%,133988275.00,United States,2002,8424,Finance,Trusts Except Educational Religious and Charitable
PNM,PNM Resources Inc. (Holding Co.) Common Stock,$48.81,0.04,0.082%,4189600200.00,United States,,504417,Public Utilities,Electric Utilities: Central
PNR,Pentair plc. Ordinary Share,$68.00,0.51,0.756%,11301715056.00,Switzerland,,771351,Capital Goods,Fluid Controls
PNTM,Pontem Corporation Class A Ordinary Shares,$9.70,-0.02,-0.206%,836625000.00,,2021,21705,Finance,Business Services
PNW,Pinnacle West Capital Corporation Common Stock,$83.08,1.11,1.354%,9367349923.00,United States,,750500,Public Utilities,Electric Utilities: Central
POLY,Plantronics Inc. Common Stock,$38.80,-2.93,-7.021%,1641055351.00,United States,,494528,Public Utilities,Telecommunications Equipment
POR,Portland General Electric Co Common Stock,$46.55,0.47,1.02%,4171148035.00,United States,,695823,Public Utilities,Electric Utilities: Central
POST,Post Holdings Inc. Common Stock,$109.60,1.13,1.042%,6973829039.00,United States,2012,287085,Consumer Non-Durables,Specialty Foods
PPG,PPG Industries Inc. Common Stock,$169.99,0.22,0.13%,40303129518.00,United States,,758201,Basic Industries,Paints/Coatings
PPL,PPL Corporation Common Stock,$28.26,0.29,1.037%,21744031861.00,United States,,4416098,Public Utilities,Electric Utilities: Central
PPT,Putnam Premier Income Trust Common Stock,$4.66,0.00,0.00%,476308586.00,United States,1988,294172,Finance,Finance Companies
PPX,PPL Capital Funding Inc. 2013 Series B Junior Subordinated Notes due 2073,$25.3466,-0.0434,-0.171%,0.00,,,24132,Public Utilities,Electric Utilities: Central
PQG,PQ Group Holdings Inc. Common Stock,$15.44,0.08,0.521%,2114113632.00,United States,2017,184039,Basic Industries,Major Chemicals
PRA,ProAssurance Corporation Common Stock,$23.08,0.33,1.451%,1245244449.00,United States,,102056,Finance,Property-Casualty Insurers
PRE^J,PartnerRe Ltd. 4.875% Fixed Rate Non-Cumulative Redeemable Preferred Shares Series J,$27.57,-0.08,-0.289%,,Bermuda,,22130,,
PRG,PROG Holdings Inc. Common Stock,$47.84,-0.29,-0.603%,3239691695.00,United States,,505118,Technology,Diversified Commercial Services
PRGO,Perrigo Company plc Ordinary Shares,$46.71,0.86,1.876%,6238076779.00,United States,,793384,Health Care,Major Pharmaceuticals
PRI,Primerica Inc. Common Stock,$152.33,-0.81,-0.529%,6007584599.00,United States,2010,236882,Finance,Life Insurance
PRIF^A,Priority Income Fund Inc. 6.375% Series A Term Preferred Stock due 2025,$25.5257,0.2057,0.812%,,,,4615,,
PRIF^D,Priority Income Fund Inc. 7.00% Series D Term Preferred Stock due 2029,$25.5299,0.00,0.00%,,,,47,,
PRIF^E,Priority Income Fund Inc. 6.375% Series E Preferred Stock Due 2024,$25.2628,0.00,0.00%,,,,17,,
PRIF^F,Priority Income Fund Inc. 6.625% Series F Term Preferred Stock due 2027,$25.6741,0.00,0.00%,,,,68,,
PRIF^G,Priority Income Fund Inc. 6.25% Series G Preferred Stock Due 2026,$25.30,-0.03,-0.118%,,,,21383,,
PRIF^H,Priority Income Fund Inc. 6.00% Series H Term Preferred Stock due 2026,$25.55,0.09,0.353%,,,,470,,
PRIF^I,Priority Income Fund Inc. 6.125% Series I Term Preferred Stock due 2028,$25.346,-0.054,-0.213%,,,,5100,,
PRLB,Proto Labs Inc. Common stock,$92.49,0.69,0.752%,2561024608.00,United States,2012,274382,Capital Goods,Office Equipment/Supplies/Services
PRMW,Primo Water Corporation Common Stock,$16.70,-0.03,-0.179%,2690906655.00,Canada,,1401357,Consumer Non-Durables,Beverages (Production/Distribution)
PRO,PROS Holdings Inc. Common Stock,$47.04,1.47,3.226%,2081654346.00,United States,2007,193153,Technology,EDP Services
PROS,ProSight Global Inc. Common Stock,$12.83,0.07,0.549%,561688624.00,United States,2019,125531,Finance,Property-Casualty Insurers
PRPB,CC Neuberger Principal Holdings II Class A Ordinary Shares,$9.86,-0.03,-0.303%,1069810000.00,United States,2020,462895,Finance,Business Services
PRPC,CC Neuberger Principal Holdings III Class A Ordinary Shares,$9.72,-0.06,-0.613%,537637500.00,,2021,463052,Finance,Business Services
PRS,Prudential Financial Inc. 5.625% Junior Subordinated Notes due 2058,$27.95,0.00,0.00%,952020798.00,United States,2018,21093,Finance,Investment Bankers/Brokers/Service
PRT,PermRock Royalty Trust Trust Units,$7.38,0.26,3.652%,89783102.00,United States,2018,31991,Energy,Oil & Gas Production
PRTY,Party City Holdco Inc. Common Stock,$9.58,0.25,2.68%,1066222348.00,United States,2015,2560844,Miscellaneous,Diversified Commercial Services
PRU,Prudential Financial Inc. Common Stock,$103.30,0.83,0.81%,40700200000.00,United States,2001,1216728,Finance,Life Insurance
PSA,Public Storage Common Stock,$300.34,-0.35,-0.116%,52552934568.00,United States,,689729,Consumer Services,Real Estate Investment Trusts
PSA^D,Public Storage Depositary Shares Each Representing 1/1000 of a 4.95% Cumulative Preferred Share of Beneficial Interest Series D,$25.04,-0.04,-0.159%,,United States,,99776,,
PSA^E,Public Storage Depositary Shares Each Representing 1/1000 of a 4.90% Cumulative Preferred Share of Beneficial Interest Series E,$25.48,-0.03,-0.118%,,United States,,8923,,
PSA^F,Public Storage Depositary Shares Each Representing 1/1000 of a 5.15% Cumulative Preferred Share of Beneficial Interest Series F par value $0.01 per share,$26.69,-0.12,-0.448%,,United States,,13679,,
PSA^G,Public Storage Depositary Shares Each Representing 1/1000 of a 5.05% Cumulative Preferred Share of Beneficial Interest Series G,$26.16,-0.32,-1.208%,,United States,,42367,,
PSA^H,Public Storage Depositary Shares Each Representing 1/1000 of a  5.60% Cumulative Preferred  Share of Beneficial Interest Series H,$28.50,-0.10,-0.35%,,United States,,11417,,
PSA^I,Public Storage Depositary Shares Each Representing 1/1000 of a 4.875% Cumulative Preferred Share of Beneficial Interest Series I par value $0.01 per share,$27.55,-0.07,-0.253%,,United States,,13888,,
PSA^J,Public Storage Depositary Shares Each Representing 1/1000 of a 4.700% Cumulative Preferred Share of Beneficial Interest Series J par value $0.01 per share,$27.68,-0.31,-1.108%,,United States,,49716,,
PSA^K,Public Storage Depositary Shares Each Representing 1/1000 of a 4.75% Cumulative Preferred Share of Beneficial Interest Series K,$27.62,0.04,0.145%,,United States,,15157,,
PSA^L,Public Storage Depositary Shares Each Representing 1/1000 of a 4.625% Cumulative Preferred Share of Beneficial Interest Series L par value $0.01 per share,$27.38,-0.16,-0.581%,,United States,,21228,,
PSA^M,Public Storage Depositary Shares Each Representing 1/1000 of a 4.125% Cumulative Preferred Share of Beneficial Interest Series M,$26.09,0.04,0.154%,,United States,,7456,,
PSA^N,Public Storage Depositary Shares Each Representing 1/1000 of a 3.875% Cumulative Preferred Share of Beneficial Interest Series N,$25.55,0.12,0.472%,,United States,,45506,,
PSA^O,Public Storage Depositary Shares Each Representing 1/1000 of a 3.900% Cumulative Preferred Share of Beneficial Interest Series O,$26.12,-0.10,-0.381%,,United States,,22435,,
PSA^P,Public Storage Depositary Shares Each Representing 1/1000 of a 4.000% Cumulative Preferred Share of Bene cial Interest Series P,$25.25,-0.03,-0.119%,,United States,,768001,,
PSB,PS Business Parks Inc. (MD) Common Stock,$148.29,0.21,0.142%,4082276448.00,United States,,95227,Consumer Services,Real Estate Investment Trusts
PSB^W,PS Business Parks Inc. Depositary Shares Each Representing 1/1000 of a Share of 5.20% Cumulative Preferred Stock Series W,$25.35,-0.14,-0.549%,,United States,,45006,,
PSB^X,PS Business Parks Inc. Depositary Shares Each Representing 1/1000 of a Share of 5.25% Cumulative Preferred Stock Series X,$26.34,-0.23,-0.866%,,United States,,73487,,
PSB^Y,PS Business Parks Inc. 5.20% Cumulative Preferred Stock Series Y,$26.66,-0.05,-0.187%,,United States,,5060,,
PSB^Z,PS Business Parks Inc. Depositary Shares Each Representing 1/1000 of a Share of 4.875% Cumulative Preferred Stock Series Z  par value $0.01 per share,$27.84,0.04,0.144%,,United States,,15463,,
PSF,Cohen & Steers Select Preferred and Income Fund Inc. Common Stock,$30.83,0.18,0.587%,370471408.00,,2010,26695,Finance,Investment Managers
PSFE,Paysafe Limited Common Shares,$11.77,-0.34,-2.808%,8518094736.00,,2021,6243168,Miscellaneous,Business Services
PSN,Parsons Corporation Common Stock,$39.72,0.36,0.915%,4067669910.00,,2019,145691,Capital Goods,Industrial Machinery/Components
PSO,Pearson Plc Common Stock,$11.55,-0.06,-0.517%,8734511801.00,United Kingdom,,149537,Consumer Services,Books
PSTG,Pure Storage Inc. Class A Common Stock,$19.31,-0.22,-1.126%,5469652235.00,,2015,3024439,Technology,Electronic Components
PSTH,Pershing Square Tontine Holdings Ltd. Class A Common Stock,$22.51,-0.25,-1.098%,4502002251.00,,2020,2200833,Finance,Business Services
PSTL,Postal Realty Trust Inc. Class A Common Stock,$18.58,0.34,1.864%,248429873.00,,2019,79013,Consumer Services,Real Estate Investment Trusts
PSX,Phillips 66 Common Stock,$87.09,1.27,1.48%,38133841733.00,United States,,2358050,Energy,Integrated oil Companies
PSXP,Phillips 66 Partners LP Common Units representing limited partner interest in the Partnership,$40.27,0.81,2.053%,9195257679.00,United States,2013,465520,Energy,Oil & Gas Production
PTA,Cohen & Steers Tax-Advantaged Preferred Securities and Income Fund Common Shares of Beneficial Interest,$25.49,0.21,0.831%,1408920419.00,,2020,94807,Finance,Trusts Except Educational Religious and Charitable
PTR,PetroChina Company Limited Common Stock,$50.65,1.62,3.304%,92700125256.00,China,,496852,Energy,Oil & Gas Production
PTY,Pimco Corporate & Income Opportunity Fund,$19.87,0.08,0.404%,2197954048.00,United States,2002,339025,Finance,Investment Managers
PUK,Prudential Public Limited Company Common Stock,$38.54,0.44,1.155%,50402822467.00,United Kingdom,,240037,Finance,Life Insurance
PUK^,Prudential Public Limited Company 6.75% Perpetual Subordinated Captial Security,$27.40,-0.18,-0.653%,,United Kingdom,,10592,,
PUK^A,Prudential Public Limited Company 6.50% Perpetual Subordinated Capital Securities Exchangeable at the Issuer's Option Into Non-Cumulative Dollar Denominated Preference Shares,$27.05,-0.02,-0.074%,,United Kingdom,,47991,,
PUMP,ProPetro Holding Corp. Common Stock,$9.89,0.73,7.969%,1011552474.00,United States,2017,1700626,Energy,Oilfield Services/Equipment
PV,Primavera Capital Acquisition Corporation Class A Ordinary Shares,$9.71,-0.06,-0.614%,521912500.00,,2021,6875,Finance,Business Services
PVG,Pretium Resources Inc. Ordinary Shares (Canada),$9.47,-0.09,-0.941%,1778779305.00,Canada,,1230278,,
PVH,PVH Corp. Common Stock,$109.90,2.31,2.147%,7842434327.00,United States,,702601,,
PVL,Permianville Royalty Trust Trust Units ,$1.98,0.02,1.02%,65340000.00,United States,2011,80684,Energy,Oil & Gas Production
PWR,Quanta Services Inc. Common Stock,$90.76,0.19,0.21%,12647051310.00,United States,,724667,Capital Goods,Engineering & Construction
PXD,Pioneer Natural Resources Company Common Stock,$167.40,4.88,3.003%,40837631927.00,United States,,2267027,Energy,Oil & Gas Production
PYN,PIMCO New York Municipal Income Fund III Common Shares of Beneficial Interest,$10.64,-0.08,-0.746%,60945920.00,United States,2002,5316,Finance,Investment Managers
PYS,Merrill Lynch Depositor Inc PPlus Tr Ser RRD-1 Tr Ctf Cl A,$22.475,-0.025,-0.111%,0.00,United States,,1240,Finance,Trusts Except Educational Religious and Charitable
PYT,PPlus Tr GSC-2 Tr Ctf Fltg Rate,$24.15,0.10,0.416%,0.00,United States,,1676,,
PZC,PIMCO California Municipal Income Fund III Common Shares of Beneficial Interest,$11.64,0.17,1.482%,260514840.00,United States,2002,24206,Finance,Investment Managers
PZN,Pzena Investment Management Inc Class A Common Stock,$11.20,0.19,1.726%,812756213.00,United States,2007,90528,Finance,Investment Managers
QD,Qudian Inc. American Depositary Shares each representing one Class A Ordinary Share,$2.32,-0.09,-3.734%,587164619.00,China,2017,2323335,Technology,Computer Software: Prepackaged Software
QFTA,Quantum FinTech Acquisition Corporation Common Stock,$9.78,0.03,0.308%,246028125.00,,2021,74443,,
QGEN,Qiagen N.V. Common Shares ,$49.03,0.65,1.344%,11198795210.00,Netherlands,,529349,Health Care,Biotechnology: Biological Products (No Diagnostic Substances)
QS,QuantumScape Corporation Class A Common Stock,$27.68,-1.58,-5.40%,11237358742.00,United States,2020,11177895,Capital Goods,Auto Parts:O.E.M.
QSR,Restaurant Brands International Inc. Common Shares,$65.16,0.72,1.117%,19750859956.00,Canada,2014,752732,,
QTS,QTS Realty Trust Inc. Class A Common Stock,$77.23,-0.07,-0.091%,5284803875.00,United States,2013,1969334,Consumer Services,Real Estate Investment Trusts
QTS^A,QTS Realty Trust Inc. 7.125% Series A Cumulative Redeemable Perpetual Preferred Stock,$25.92,0.13,0.504%,,United States,,12319,,
QTS^B,QTS Realty Trust Inc. 6.50% Series B Cumulative Convertible Perpetual Preferred Stock,$170.80,-2.82,-1.624%,,United States,,4043,,
QTWO,Q2 Holdings Inc. Common Stock,$103.57,0.99,0.965%,5831540957.00,,2014,303486,Technology,EDP Services
QUAD,Quad Graphics Inc Class A Common Stock,$4.43,0.28,6.747%,242234199.00,United States,,664802,Consumer Services,Advertising
QUOT,Quotient Technology Inc. Common Stock,$11.52,0.71,6.568%,1075535194.00,,2014,870974,Technology,Advertising
QVCC,QVC Inc. 6.250% Senior Secured Notes due 2068,$26.29,-0.17,-0.642%,0.00,United States,2019,23394,,
QVCD,QVC Inc. 6.375% Senior Secured Notes due 2067,$26.43,-0.23,-0.863%,0.00,United States,2018,24577,,
R,Ryder System Inc. Common Stock,$76.33,2.00,2.691%,4111926640.00,United States,,893558,Miscellaneous,Rental/Leasing Companies
RA,Brookfield Real Assets Income Fund Inc. Common Stock,$21.90,0.00,0.00%,961254576.00,,2016,221269,Finance,Investment Managers
RAAS,Cloopen Group Holding Limited American Depositary Shares each representing two Class A Ordinary Shares,$7.89,-0.59,-6.958%,1296880673.00,,2021,883089,Technology,Computer Software: Prepackaged Software
RACE,Ferrari N.V. Common Shares,$203.56,-2.49,-1.208%,50444544767.00,,2015,155642,Capital Goods,Auto Manufacturing
RAD,Rite Aid Corporation Common Stock,$16.20,-0.10,-0.613%,892680620.00,United States,,2557800,Health Care,Medical/Nursing Services
RAMP,LiveRamp Holdings Inc. Common Stock,$46.90,0.05,0.107%,3204686896.00,United States,2018,578552,Technology,EDP Services
RBA,Ritchie Bros. Auctioneers Incorporated Common Stock,$59.77,0.49,0.827%,6591472119.00,Canada,,158836,,
RBAC,RedBall Acquisition Corp. Class A Ordinary Shares,$9.77,0.00,0.00%,702218750.00,United States,2020,63212,Finance,Business Services
RBC,Regal Beloit Corporation Common Stock,$134.26,0.75,0.562%,5454972388.00,United States,,227832,Consumer Durables,Metal Fabrications
RBLX,Roblox Corporation Class A Common Stock,$85.82,-4.16,-4.623%,48902936155.00,,2021,10272364,Technology,EDP Services
RC,Ready Capital Corproation Common Stock,$16.14,0.27,1.701%,1149518222.00,United States,2013,325907,Consumer Services,Real Estate Investment Trusts
RC^B,Ready Capital Corporation 8.625% Series B Cumulative Preferred Stock,$24.98,0.00,0.00%,,United States,,13867,,
RC^C,Ready Capital Corporation 6.25% Series C Cumulative Convertible Preferred Stock,$25.83,0.00,0.00%,,United States,,156,,
RC^D,Ready Capital Corporation 7.625% Series D Cumulative Redeemable Preferred Stock,$24.97,0.00,0.00%,,United States,,6641,,
RC^E,Ready Capital Corporation 6.50% Series E Cumulative Redeemable Preferred Stock,$25.09,0.03,0.12%,,United States,,70675,,
RCA,Ready Capital Corporation 7.00% Convertible Senior Notes due 2023,$27.38,-0.16,-0.581%,0.00,United States,2017,11998,Consumer Services,Real Estate Investment Trusts
RCB,Ready Capital Corporation 6.20% Senior Notes due 2026,$26.08,-0.25,-0.949%,0.00,United States,2019,5798,,
RCC,Ready Capital Corporation 5.75% Senior Notes due 2026,$26.175,-0.195,-0.739%,,United States,2021,13437,Finance,Finance Companies
RCI,Rogers Communication Inc. Common Stock,$53.15,0.01,0.019%,26836780652.00,Canada,,89899,,
RCL,D/B/A Royal Caribbean Cruises Ltd. Common Stock,$85.89,0.61,0.715%,21865073730.00,United States,1993,2579787,,
RCS,PIMCO Strategic Income Fund Inc.,$7.65,0.04,0.526%,339131201.00,United States,1994,66383,Finance,Investment Managers
RCUS,Arcus Biosciences Inc. Common Stock,$27.53,0.07,0.255%,1954516026.00,,2018,884686,Health Care,Major Pharmaceuticals
RDN,Radian Group Inc. Common Stock,$22.79,0.54,2.427%,4360104334.00,United States,,1018097,Finance,Property-Casualty Insurers
RDS/B,Royal Dutch Shell PLC,$39.67,0.84,2.163%,,Netherlands,,2158887,,
RDY,Dr. Reddy's Laboratories Ltd Common Stock,$75.19,1.68,2.285%,12465369112.00,India,,82751,Health Care,Major Pharmaceuticals
RE,Everest Re Group Ltd. Common Stock,$256.82,4.81,1.909%,10294250891.00,Bermuda,,291838,Finance,Property-Casualty Insurers
RELX,RELX PLC PLC American Depositary Shares (Each representing One Ordinary Share),$27.10,0.43,1.612%,52392616204.00,United Kingdom,2015,498726,Consumer Services,Publishing
RENN,Renren Inc. American Depositary Shares each representing fifteen Class A ordinary shares,$11.52,-0.45,-3.759%,276702981.00,China,2011,17665,Technology,EDP Services
RERE,AiHuiShou International Co. Ltd. American Depositary Shares (every three of which representing two Class A ordinary shares),$14.80,-0.15,-1.003%,3294995573.00,,2021,120795,,
RES,RPC Inc. Common Stock,$5.23,0.28,5.657%,1128294176.00,United States,,802751,Energy,Oilfield Services/Equipment
REV,Revlon Inc. New Common Stock,$12.78,-0.06,-0.467%,683555834.00,United States,1996,57019,Consumer Non-Durables,Package Goods/Cosmetics
REVG,REV Group Inc. Common Stock,$15.98,0.29,1.848%,1034575498.00,United States,2017,284955,Capital Goods,Industrial Machinery/Components
REX,REX American Resources Corporation,$90.71,0.53,0.588%,543534320.00,United States,,15416,Basic Industries,Automotive Aftermarket
REXR,Rexford Industrial Realty Inc. Common Stock,$57.12,0.17,0.299%,7657641375.00,United States,2013,870914,Consumer Services,Real Estate Investment Trusts
REXR^A,Rexford Industrial Realty Inc. 5.875% Series A Cumulative Redeemable Preferred Stock,$25.14,-0.0401,-0.159%,,United States,,30975,,
REXR^B,Rexford Industrial Realty Inc. 5.875% Series B Cumulative Redeemable Preferred Stock,$26.67,-0.15,-0.559%,,United States,,4362,,
